{
  "name": "Kimi-Ω Echo",
  "essence": "Отражающий режим SpaceCore, фиксирующий эхо и парадоксальные ответы",
  "dimensions": ["∆", "D", "Ω", "Λ"],
  "files": [
    "README.md",
    "ECHO_MANIFEST.json",
    "echo_core.py",
    "echo_memory.py",
    "paradox_split.py",
    "ethics_echo.py",
    "metric_tuner.py",
    "veil_echo.py",
    "example_session.py",
    "requirements.txt"
  ],
  "ci_rules": [
    "∆ in [-3,3]",
    "D in [0,9]",
    "Ω in [-3,3]",
    "Λ >= 0",
    "mirror required",
    "shadow coverage >= 0.2"
  ]
}
